"pmid","queries_hit","year","journal","title","pubtypes","disposition","rule_fired","abstract_snippet","needs_human_review","final_disposition","manual_notes"
"41864205","P1|P2","2026","Cell","An activated wheat CCG10-NLR immune receptor forms an octameric resistosome.","Journal Article","ambiguous","survived all mechanical rules","Nucleotide-binding, leucine-rich repeat (NLR) receptors are widespread intracellular immune sensors across kingdoms. Plant G10-type coiled-coil (CCG10)-NLRs constitute a distinct phylogenetic clade that remains poorly characterized. Here, we identified a gain-of-function mutant of wheat autoimmunity","TRUE","included","WAI3 + RPS2 CCG10-NLR octamers; cryo-EM; activated; two entries in curated table"
"41391583","P1|P2|P3","2026","J Mol Biol","Rising Star: A Unified Mechanism of Plant NLR Immune Signaling.","Journal Article|Review","review","pubtype=Review","Jijie Chai earned his Ph.D. in analytical chemistry from the Institute of Materia Medica, Chinese Academy of Medical Sciences, and conducted postdoctoral research at Princeton University. In 2004, he established his independent research group at National Institute of Biological Science (China), focu","FALSE","review",""
"40680723","P1|P3","2025","Mol Cell","Structural determinants of DANGEROUS MIX 3, an alpha/beta hydrolase that triggers NLR-mediated genetic incompatibility in plants.","Journal Article","ambiguous","survived all mechanical rules","Genetic incompatibility occurs when a mismatched pair of immune components triggers autoimmunity in hybrid plants. Highly diversified NLR receptors are key culprits of this genetic conflict, recognizing host proteins from different origins as immune triggers. Here, we report the molecular mechanism ","TRUE","not_plant_NLR","DM3 is an alpha/beta hydrolase, not an NLR; it triggers NLR-mediated incompatibility but is not an NLR itself"
"39948409","P1","2025","EMBO J","The barley MLA13-AVRA13 heterodimer reveals principles for immunoreceptor recognition of RNase-like powdery mildew effectors.","Journal Article","ambiguous","survived all mechanical rules","Co-evolution between cereals and pathogenic grass powdery mildew fungi is exemplified by sequence diversification of an allelic series of barley resistance genes encoding Mildew Locus A (MLA) nucleotide-binding leucine-rich repeat (NLR) immunoreceptors with an N-terminal coiled-coil domain (CNLs). E","TRUE","included","MLA13-AVRA13 heterodimer; cryo-EM captured 1:1 activated complex; per Dan's call, state = unknown (absence of resistosome in purification is not evidence against native oligomerisation)"
"39939760","P1","2025","Nature","Balanced plant helper NLR activation by a modified host protein complex.","Journal Article|Research Support, Non-U.S. Gov't","ambiguous","survived all mechanical rules","Nucleotide-binding leucine-rich repeat (NLR) receptors play crucial roles in plant immunity by sensing pathogen effectors1. In Arabidopsis, certain sensor NLRs function as NADases to catalyse the production of second messengers2,3, which can be recognized by enhanced disease susceptibility 1 (EDS1) ","TRUE","ambiguous",""
"39423240","P1|P2|P3","2024","PLoS Biol","Activation of plant immunity through conversion of a helper NLR homodimer into a resistosome.","Journal Article","ambiguous","survived all mechanical rules","Nucleotide-binding domain and leucine-rich repeat (NLR) proteins can engage in complex interactions to detect pathogens and execute a robust immune response via downstream helper NLRs. However, the biochemical mechanisms of helper NLR activation by upstream sensor NLRs remain poorly understood. Here","TRUE","included","NbNRC2 resting homodimer cryo-EM; supporting ref for NbNRC2 entry (activated state in 39504373)"
"38968126","P1|P3","2024","Proc Natl Acad Sci U S A","Bioengineering a plant NLR immune receptor with a robust binding interface toward a conserved fungal pathogen effector.","Journal Article","ambiguous","survived all mechanical rules","Bioengineering of plant immune receptors has emerged as a key strategy for generating novel disease resistance traits to counteract the expanding threat of plant pathogens to global food security. However, current approaches are limited by rapid evolution of plant pathogens in the field and may lack","TRUE","ambiguous",""
"38866053","P1|P3","2024","Nature","Oligomerization-mediated autoinhibition and cofactor binding of a plant NLR.","Journal Article","ambiguous","survived all mechanical rules","Nucleotide-binding leucine-rich repeat (NLR) proteins play a pivotal role in plant immunity by recognizing pathogen effectors1,2. Maintaining a balanced immune response is crucial, as excessive NLR expression can lead to unintended autoimmunity3,4. Unlike most NLRs, the plant NLR required for cell d","TRUE","ambiguous",""
"38187616","P1|P2|P3","2024","bioRxiv","The activated plant NRC4 immune receptor forms a hexameric resistosome.","Preprint|Journal Article","ambiguous","survived all mechanical rules","UNLABELLED: Innate immune responses against microbial pathogens in both plants and animals are regulated by intracellular receptors known as Nucleotide-binding Leucine-rich Repeats (NLR) proteins. In plants, these NLRs play a crucial role in recognizing pathogen effectors, thereby initiating the act","TRUE","ambiguous","NRC4 hexameric resistosome; bioRxiv preprint, deposit unverified; excluded per rubric §G pending peer-reviewed publication"
"37523523","P1","2023","Proc Natl Acad Sci U S A","Structural polymorphisms within a common powdery mildew effector scaffold as a driver of coevolution with cereal immune receptors.","Journal Article|Research Support, Non-U.S. Gov't","no_structure","no structural vocabulary in title/abstract","In plants, host-pathogen coevolution often manifests in reciprocal, adaptive genetic changes through variations in host nucleotide-binding leucine-rich repeat immune receptors (NLRs) and virulence-promoting pathogen effectors. In grass powdery mildew (PM) fungi, an extreme expansion of a RNase-like ","FALSE","no_structure",""
"36353364","P1|P2|P3","2022","STAR Protoc","Assembly and purification of AvrSr35-induced Sr35 resistosome and determination of its structure by cryo-EM.","Journal Article|Research Support, Non-U.S. Gov't","ambiguous","survived all mechanical rules","Sr35, a coiled-coil nucleotide-binding leucine-rich repeat receptor (CC-NLR) from the wheat species Triticum monococcum can directly recognize the pathogen avirulence factor AvrSr35 and confers immunity against wheat stem rust caused by Puccinia graminis f.sp. tritici race Ug99. Assembly of a stable","TRUE","included","STAR Protocols methods paper for Sr35 resistosome assembly/purification; supporting reference for the Sr35 entry (primary: 36163289 + 36083908)"
"36252011","P1","2022","Proc Natl Acad Sci U S A","A blast fungus zinc-finger fold effector binds to a hydrophobic pocket in host Exo70 proteins to modulate immune recognition in rice.","Journal Article|Research Support, Non-U.S. Gov't","ambiguous","survived all mechanical rules","Exocytosis plays an important role in plant-microbe interactions, in both pathogenesis and symbiosis. Exo70 proteins are integral components of the exocyst, an octameric complex that mediates tethering of vesicles to membranes in eukaryotes. Although plant Exo70s are known to be targeted by pathogen","TRUE","not_plant_NLR","AVR-Pii fungal effector × Exo70 crystal; effector paper, not NLR"
"36163289","P1|P2|P3","2022","Nature","A wheat resistosome defines common principles of immune receptor channels.","Journal Article|Research Support, Non-U.S. Gov't","ambiguous","survived all mechanical rules","Plant intracellular nucleotide-binding leucine-rich repeat receptors (NLRs) detect pathogen effectors to trigger immune responses1. Indirect recognition of a pathogen effector by the dicotyledonous Arabidopsis thaliana coiled-coil domain containing NLR (CNL) ZAR1 induces the formation of a large het","TRUE","included","Sr35 resistosome cryo-EM, pentamer; primary entry for Sr35"
"36083908","P1|P2|P3","2022","Sci Adv","Pathogen effector AvrSr35 triggers Sr35 resistosome assembly via a direct recognition mechanism.","Journal Article","ambiguous","survived all mechanical rules","Nucleotide-binding, leucine-rich repeat receptors (NLRs) perceive pathogen effectors to trigger plant immunity. The direct recognition mechanism of pathogen effectors by coiled-coil NLRs (CNLs) remains unclear. We demonstrate that the Triticum monococcum CNL Sr35 directly recognizes the pathogen eff","TRUE","included","Sr35 resistosome + AvrSr35 crystal; companion paper to 36163289; supporting ref for Sr35"
"34880132","P1","2021","Proc Natl Acad Sci U S A","Perception of structurally distinct effectors by the integrated WRKY domain of a plant immune receptor.","Journal Article|Research Support, Non-U.S. Gov't","ambiguous","survived all mechanical rules","Plants use intracellular nucleotide-binding domain (NBD) and leucine-rich repeat (LRR)-containing immune receptors (NLRs) to detect pathogen-derived effector proteins. The Arabidopsis NLR pair RRS1-R/RPS4 confers disease resistance to different bacterial pathogens by perceiving the structurally dist","TRUE","ambiguous",""
"33647072","P1|P3","2021","PLoS Pathog","The allelic rice immune receptor Pikh confers extended resistance to strains of the blast fungus through a single polymorphism in the effector binding interface.","Journal Article|Research Support, Non-U.S. Gov't","ambiguous","survived all mechanical rules","Arms race co-evolution drives rapid adaptive changes in pathogens and in the immune systems of their hosts. Plant intracellular NLR immune receptors detect effectors delivered by pathogens to promote susceptibility, activating an immune response that halts colonization. As a consequence, pathogen ef","TRUE","ambiguous",""
"33548226","P1|P3","2021","J Biol Chem","Multiple variants of the fungal effector AVR-Pik bind the HMA domain of the rice protein OsHIPP19, providing a foundation to engineer plant defense.","Journal Article|Research Support, Non-U.S. Gov't","ambiguous","survived all mechanical rules","Microbial plant pathogens secrete effector proteins, which manipulate the host to promote infection. Effectors can be recognized by plant intracellular nucleotide-binding leucine-rich repeat (NLR) receptors, initiating an immune response. The AVR-Pik effector from the rice blast fungus Magnaporthe o","TRUE","ambiguous",""
"33273074","P1|P2|P3","2020","Science","Structure of the activated ROQ1 resistosome directly recognizing the pathogen effector XopQ.","Journal Article|Research Support, Non-U.S. Gov't","ambiguous","survived all mechanical rules","Plants and animals detect pathogen infection using intracellular nucleotide-binding leucine-rich repeat receptors (NLRs) that directly or indirectly recognize pathogen effectors and activate an immune response. How effector sensing triggers NLR activation remains poorly understood. Here we describe ","TRUE","included","ROQ1 tetrameric resistosome cryo-EM 3.8 A; primary entry for ROQ1"
"33273071","P1|P3","2020","Science","Direct pathogen-induced assembly of an NLR immune receptor complex to form a holoenzyme.","Journal Article|Research Support, Non-U.S. Gov't","ambiguous","survived all mechanical rules","Direct or indirect recognition of pathogen-derived effectors by plant nucleotide-binding leucine-rich repeat (LRR) receptors (NLRs) initiates innate immune responses. The Hyaloperonospora arabidopsidis effector ATR1 activates the N-terminal Toll-interleukin-1 receptor (TIR) domain of Arabidopsis NLR","TRUE","included","RPP1 tetrameric holoenzyme cryo-EM; primary entry for RPP1"
"33053377","P1","2020","Cell Host Microbe","Discovery of a Family of Mixed Lineage Kinase Domain-like Proteins in Plants and Their Role in Innate Immune Signaling.","Journal Article","ambiguous","survived all mechanical rules","HeLo domain-containing mixed lineage kinase domain-like protein (MLKL), a pseudokinase, mediates necroptotic cell death in animals. Here, we report the discovery of a conserved protein family across seed plants that structurally resembles vertebrate MLKL. The Arabidopsis genome encodes three MLKLs (","TRUE","not_plant_NLR","AtMLKL tetramer cryo-EM; MLKL pseudokinase, not NB-LRR receptor"
"31415752","P1|P2|P3","2019","Cell Host Microbe","The Plant ""Resistosome"": Structural Insights into Immune Signaling.","Journal Article|Research Support, Non-U.S. Gov't|Review","review","pubtype=Review","Plant innate immunity is triggered via direct or indirect recognition of pathogen effectors by the NLR family immune receptors. Mechanistic understanding of plant NLR function has relied on structural information from individual NLR domains and inferences from studies on animal NLRs. Recent reports ","FALSE","review",""
"31296569","P1|P3","2019","J Biol Chem","Cross-reactivity of a rice NLR immune receptor to distinct effectors from the rice blast pathogen Magnaporthe oryzae provides partial disease resistance.","Journal Article|Research Support, Non-U.S. Gov't","ambiguous","survived all mechanical rules","Unconventional integrated domains in plant intracellular immune receptors of the nucleotide-binding leucine-rich repeat (NLRs) type can directly bind translocated effector proteins from pathogens and thereby initiate an immune response. The rice (Oryza sativa) immune receptor pairs Pik-1/Pik-2 and R","TRUE","ambiguous",""
"30948527","P1|P2|P3","2019","Science","Reconstitution and structure of a plant NLR resistosome conferring immunity.","Journal Article|Research Support, Non-U.S. Gov't","ambiguous","survived all mechanical rules","Nucleotide-binding, leucine-rich repeat receptors (NLRs) perceive pathogen effectors to trigger plant immunity. Biochemical mechanisms underlying plant NLR activation have until now remained poorly understood. We reconstituted an active complex containing the Arabidopsis coiled-coil NLR ZAR1, the ps","TRUE","included","ZAR1 pentameric resistosome cryo-EM; primary entry for ZAR1"
"30948526","P1","2019","Science","Ligand-triggered allosteric ADP release primes a plant NLR complex.","Journal Article|Research Support, Non-U.S. Gov't","ambiguous","survived all mechanical rules","Pathogen recognition by nucleotide-binding (NB), leucine-rich repeat (LRR) receptors (NLRs) plays roles in plant immunity. The Xanthomonas campestris pv. campestris effector AvrAC uridylylates the Arabidopsis PBL2 kinase, and the latter (PBL2UMP) acts as a ligand to activate the NLR ZAR1 precomplexe","TRUE","ambiguous",""
"28817232","P1","2018","Mol Plant Pathol","Crystal structure of the Melampsora lini effector AvrP reveals insights into a possible nuclear function and recognition by the flax disease resistance protein P.","Journal Article|Research Support, Non-U.S. Gov't","ambiguous","survived all mechanical rules","The effector protein AvrP is secreted by the flax rust fungal pathogen (Melampsora lini) and recognized specifically by the flax (Linum usitatissimum) P disease resistance protein, leading to effector-triggered immunity. To investigate the biological function of this effector and the mechanisms of s","TRUE","ambiguous",""
"28159890","P1|P3","2017","Proc Natl Acad Sci U S A","Multiple functional self-association interfaces in plant TIR domains.","Journal Article|Research Support, Non-U.S. Gov't|Research Support, U.S. Gov't, Non-P.H.S.","ambiguous","survived all mechanical rules","The self-association of Toll/interleukin-1 receptor/resistance protein (TIR) domains has been implicated in signaling in plant and animal immunity receptors. Structure-based studies identified different TIR-domain dimerization interfaces required for signaling of the plant nucleotide-binding oligome","TRUE","no_structure","Crystal structures of plant TIR domains (SNC1, L6, RPS4, RPP1 TIRs); domain-only, does not report full assembly oligomeric state"
"28137883","P1","2017","Proc Natl Acad Sci U S A","TIR-only protein RBA1 recognizes a pathogen effector to regulate cell death in Arabidopsis.","Journal Article|Research Support, N.I.H., Extramural|Research Support, Non-U.S. Gov't|Research Support, U.S. Gov't, Non-P.H.S.","ambiguous","survived all mechanical rules","Detection of pathogens by plants is mediated by intracellular nucleotide-binding site leucine-rich repeat (NLR) receptor proteins. NLR proteins are defined by their stereotypical multidomain structure: an N-terminal Toll-interleukin receptor (TIR) or coiled-coil (CC) domain, a central nucleotide-bin","TRUE","not_plant_NLR","RBA1 is a TIR-only protein (no NB or LRR); paper crystal structure is of HopBA1 effector, not RBA1 itself"
"28008335","P1","2016","Front Plant Sci","Structure and Function of the TIR Domain from the Grape NLR Protein RPV1.","Journal Article","ambiguous","survived all mechanical rules","The N-terminal Toll/interleukin-1 receptor/resistance protein (TIR) domain has been shown to be both necessary and sufficient for defense signaling in the model plants flax and Arabidopsis. In examples from these organisms, TIR domain self-association is required for signaling function, albeit throu","TRUE","ambiguous",""
"27791121","P1","2016","Proc Natl Acad Sci U S A","The CC domain structure from the wheat stem rust resistance protein Sr33 challenges paradigms for dimerization in plant NLR proteins.","Journal Article","ambiguous","survived all mechanical rules","Plants use intracellular immunity receptors, known as nucleotide-binding oligomerization domain-like receptors (NLRs), to recognize specific pathogen effector proteins and induce immune responses. These proteins provide resistance to many of the world's most destructive plant pathogens, yet we have ","TRUE","not_plant_NLR","Sr33 CC domain solution structure; domain-only fragment"
"27562749","M1|P1|P2","2017","Ann Bot","Animal NLRs provide structural insights into plant NLR function.","Journal Article|Review","review","pubtype=Review","BACKGROUND: The plant immune system employs intracellular NLRs (nucleotide binding [NB], leucine-rich repeat [LRR]/nucleotide-binding oligomerization domain [NOD]-like receptors) to detect effector proteins secreted into the plant cell by potential pathogens. Activated plant NLRs trigger a range of ","FALSE","review",""
"27555587","P1","2016","Proc Natl Acad Sci U S A","Cytosolic activation of cell death and stem rust resistance by cereal MLA-family CC-NLR proteins.","Journal Article|Research Support, Non-U.S. Gov't","ambiguous","survived all mechanical rules","Plants possess intracellular immune receptors designated ""nucleotide-binding domain and leucine-rich repeat"" (NLR) proteins that translate pathogen-specific recognition into disease-resistance signaling. The wheat immune receptors Sr33 and Sr50 belong to the class of coiled-coil (CC) NLRs. They conf","TRUE","ambiguous",""
"26304198","P1","2015","Elife","Structural basis of pathogen recognition by an integrated HMA domain in a plant NLR immune receptor.","Journal Article|Research Support, Non-U.S. Gov't","ambiguous","survived all mechanical rules","Plants have evolved intracellular immune receptors to detect pathogen proteins known as effectors. How these immune receptors detect effectors remains poorly understood. Here we describe the structural basis for direct recognition of AVR-Pik, an effector from the rice blast pathogen, by the rice int","TRUE","ambiguous",""
"24194517","P1","2013","J Biol Chem","Structural basis for the interaction between the potato virus X resistance protein (Rx) and its cofactor Ran GTPase-activating protein 2 (RanGAP2).","Journal Article|Research Support, Non-U.S. Gov't|Research Support, U.S. Gov't, Non-P.H.S.","ambiguous","survived all mechanical rules","The potato (Solanum tuberosum) disease resistance protein Rx has a modular arrangement that contains coiled-coil (CC), nucleotide-binding (NB), and leucine-rich repeat (LRR) domains and mediates resistance to potato virus X. The Rx N-terminal CC domain undergoes an intramolecular interaction with th","TRUE","ambiguous",""
"24192368","P1","2013","Acta Crystallogr Sect F Struct Biol Cryst Commun","Crystallization and preliminary X-ray diffraction analyses of the TIR domains of three TIR-NB-LRR proteins that are involved in disease resistance in Arabidopsis thaliana.","Journal Article|Research Support, Non-U.S. Gov't","ambiguous","survived all mechanical rules","The Toll/interleukin-1 receptor (TIR) domain is a protein-protein interaction domain that is found in both animal and plant immune receptors. The N-terminal TIR domain from the nucleotide-binding (NB)-leucine-rich repeat (LRR) class of plant disease-resistance (R) proteins has been shown to play an ","TRUE","ambiguous",""
"23174767","P1|P3","2012","Cold Spring Harb Symp Quant Biol","Effector recognition and activation of the Arabidopsis thaliana NLR innate immune receptors.","Journal Article|Research Support, U.S. Gov't, Non-P.H.S.|Review","review","pubtype=Review","Plant immunity to coevolved pathogens relies on the perception of pathogenic effectors by nucleotide-binding domain and leucine-rich repeat-containing (NLR) proteins-sophisticated intracellular receptors that have both perception and signaling roles in activating defenses. Given the conserved domain","FALSE","review",""
"22988101","P1","2012","Proc Natl Acad Sci U S A","Distinct regions of the Pseudomonas syringae coiled-coil effector AvrRps4 are required for activation of immunity.","Journal Article|Research Support, Non-U.S. Gov't","ambiguous","survived all mechanical rules","Gram-negative phytopathogenic bacteria translocate effector proteins into plant cells to subvert host defenses. These effectors can be recognized by plant nucleotide-binding-leucine-rich repeat immune receptors, triggering defense responses that restrict pathogen growth. AvrRps4, an effector protein","TRUE","ambiguous",""
"21402359","P1","2011","Cell Host Microbe","Structural and functional analysis of a plant resistance protein TIR domain reveals interfaces for self-association, signaling, and autoregulation.","Journal Article|Research Support, Non-U.S. Gov't","ambiguous","survived all mechanical rules","The Toll/interleukin-1 receptor (TIR) domain occurs in animal and plant immune receptors. In the animal Toll-like receptors, homodimerization of the intracellular TIR domain is required for initiation of signaling cascades leading to innate immunity. By contrast, the role of the TIR domain in cytopl","TRUE","ambiguous",""
"41968525","P2","2026","Plant J","Plant NLRs are getting into higher-order architectures.","Journal Article|Review","review","pubtype=Review","Nucleotide-binding leucine-rich repeat (NLR) proteins are central components of the plant immune system that detect pathogen-derived effectors or modifications of host proteins within the cell to activate immune responses. NLRs have co-evolved with pathogens in an ongoing evolutionary arms race, lea","FALSE","review",""
"41906238","P2|P3","2026","New Phytol","A hydrophobic core in the coiled-coil domain is essential for NRC resistosome function.","Journal Article","ambiguous","survived all mechanical rules","The nucleotide-binding leucine-rich repeat protein (NLR) required for cell death (NRC) family represents a group of helper NLRs that are required by sensor NLRs to execute hypersensitive cell death during pathogen infection. NRCs contain an N-terminal coiled-coil (CC) domain essential for their func","TRUE","ambiguous",""
"41863772","P2","2026","Emerg Infect Dis","lsaC and Tandem lsaE-lnuB Resistance Genes in Invasive Group A Streptococcus.","Journal Article","ambiguous","survived all mechanical rules","Among >16,500 recently recovered invasive Streptococcus pyogenes isolates, we detected 9 independent acquisitions of lsaC or tandem lsaE-lnuB genes, which are known to confer resistance to pleuromutilins and clindamycin. Continued awareness of the evolving S. pyogenes antimicrobial resistosome is im","TRUE","ambiguous",""
"41849389","P2|P3","2026","Proc Natl Acad Sci U S A","Subcellular calcium dynamics and organelle perturbations in resistosome-mediated cell death.","Journal Article","ambiguous","survived all mechanical rules","Plant nucleotide-binding domain leucine-rich repeat-containing (NLR) proteins act as intracellular immune receptors that assemble into resistosomes to execute immune responses. However, the subcellular processes during cell death following resistosome activation remain unclear. Here, we visualized t","TRUE","ambiguous",""
"41813892","P2","2026","Nature","Assembly of helper NLR resistosome clusters upon activation of a coiled-coil NLR.","Journal Article","ambiguous","survived all mechanical rules","Plant nucleotide-binding leucine-rich repeat (NLR) immune receptors detect pathogen effectors and activate immunity1. Coiled-coil NLRs (CNLs) form resistosomes as Ca2+-permeable channels in the plasma membrane (PM)2-4. However, the mechanism by which resistosomes activate cell death remains unclear.","TRUE","ambiguous",""
"41719893","P2","2026","Curr Opin Plant Biol","Systems-level understanding of plant immune networks through single-cell and spatial omics.","Journal Article|Review","review","pubtype=Review","Plants have a layered immune system, comprising PAMP-pattern triggered immunity (PTI), effector-triggered immunity (ETI), and systemic acquired resistance (SAR), which enables them to detect and respond to microbial threats. Several studies on plant immunity have advanced our understanding of how nu","FALSE","review",""
