"pmid","queries_hit","year","journal","title","pubtypes","disposition","rule_fired","abstract_snippet","needs_human_review","final_disposition","manual_notes"
"21342182","M1","2011","Immunology","Nucleotide-binding and oligomerization domain-like receptors and retinoic acid inducible gene-like receptors in human tonsillar T lymphocytes.","Journal Article|Research Support, Non-U.S. Gov't","ambiguous","survived all mechanical rules","Nucleotide-binding and oligomerization domain (NOD)-like receptors (NLRs) and retinoic acid-inducible gene (RIG)-like receptors (RLRs) are recently discovered cytosolic pattern-recognition receptors sensing mainly bacterial components and viral RNA, respectively. Their importance in various cells an","TRUE","ambiguous",""
"21209283","M1","2011","J Immunol","NLRP4 negatively regulates autophagic processes through an association with beclin1.","Journal Article|Research Support, Non-U.S. Gov't","ambiguous","survived all mechanical rules","Although more than 20 putative members have been assigned to the nucleotide-binding and oligomerization domain-like receptor (NLR) family, their physiological and biological roles, with the exception of the inflammasome, are not fully understood. In this article, we show that NLR members, such as NL","TRUE","ambiguous",""
"20584763","M1","2010","Int Immunol","Quantitative expression of RIG-like helicase, NOD-like receptor and inflammasome-related mRNAs in humans and mice.","Journal Article|Research Support, Non-U.S. Gov't","ambiguous","survived all mechanical rules","The cell-type-, organ- and species-specific expression of the surface and endosomally located Toll-like receptors are well described but little is known about the respective expression profiles of cytosolic pattern recognition molecules. We therefore determined the mRNA expression levels of 15 cytos","TRUE","ambiguous",""
"20566831","M1","2010","J Immunol","Involvement of absent in melanoma 2 in inflammasome activation in macrophages infected with Listeria monocytogenes.","Journal Article","ambiguous","survived all mechanical rules","Listeria monocytogenes invades the cytoplasm of macrophages and induces the activation of caspase-1 and the subsequent maturation of IL-1beta and IL-18. Although apoptosis-associated speck-like protein containing a caspase-activating and recruitment domain (ASC), an adaptor protein of nucleotide-bin","TRUE","ambiguous",""
"20562263","M1","2010","J Immunol","Cutting edge: Cytosolic bacterial DNA activates the inflammasome via Aim2.","Journal Article|Research Support, N.I.H., Extramural","ambiguous","survived all mechanical rules","Pathogens are detected by pattern recognition receptors that, upon activation, orchestrate an appropriate immune response. The TLRs and the nucleotide-binding oligomerization domain-like receptors (NLRs) are prototypic pattern recognition receptors that detect extracellular and cytosolic pathogens, ","TRUE","ambiguous",""
"20490635","M1","2010","J Clin Immunol","Involvement of the AIM2, NLRC4, and NLRP3 inflammasomes in caspase-1 activation by Listeria monocytogenes.","Journal Article|Research Support, N.I.H., Extramural|Research Support, Non-U.S. Gov't","ambiguous","survived all mechanical rules","Infection with Listeria monocytogenes can cause meningitis and septicemia in newborn, elderly, or immunocompromised individuals. Pregnant women are particularly susceptible to Listeria, leading to a potentially fatal infection. Cytosolic Listeria activates the proinflammatory caspase-1 and induces t","TRUE","ambiguous",""
"20478539","M1","2010","Cell Host Microbe","A Yersinia effector protein promotes virulence by preventing inflammasome recognition of the type III secretion system.","Journal Article|Research Support, N.I.H., Extramural|Research Support, Non-U.S. Gov't","ambiguous","survived all mechanical rules","Bacterial pathogens utilize pore-forming toxins or specialized secretion systems to deliver virulence factors to modulate host cell physiology and promote bacterial replication. Detection of these secretion systems or toxins, or their activities, by nucleotide-binding oligomerization domain leucine-","TRUE","ambiguous",""
"19483708","M1","2009","Nat Rev Drug Discov","Unleashing the therapeutic potential of NOD-like receptors.","Journal Article|Review","review","pubtype=Review","Nucleotide-binding and oligomerization domain (NOD)-like receptors (NLRs) are a family of intracellular sensors that have key roles in innate immunity and inflammation. Whereas some NLRs - including NOD1, NOD2, NAIP (NLR family, apoptosis inhibitory protein) and NLRC4 - detect conserved bacterial mo","FALSE","review",""
"19120480","M1","2009","Immunol Rev","Function of Nod-like receptors in microbial recognition and host defense.","Journal Article|Research Support, N.I.H., Extramural|Review","review","pubtype=Review","Nucleotide oligomerization domain (NOD)-like receptors (NLRs) are a specialized group of intracellular proteins that play a critical role in the regulation of the host innate immune response. NLRs act as scaffolding proteins that assemble signaling platforms that trigger nuclear factor-kappaB and mi","FALSE","review",""
"18453601","M1","2008","J Immunol","NAIP and Ipaf control Legionella pneumophila replication in human cells.","Journal Article|Research Support, Non-U.S. Gov't","ambiguous","survived all mechanical rules","In mice, different alleles of the mNAIP5 (murine neuronal apoptosis inhibitory protein-5)/mBirc1e gene determine whether macrophages restrict or support intracellular replication of Legionella pneumophila, and whether a mouse is resistant or (moderately) susceptible to Legionella infection. In the r","TRUE","ambiguous",""
"17960661","M1","2007","Eur J Immunol","Orchestration of pathogen recognition by inflammasome diversity: Variations on a common theme.","Comment|Journal Article|Review","review","pubtype=Review","Innate immunity is a crucial part of the immune system, capable of mounting specific host responses against distinct pathogens. An integral component of the innate immune system is a network of pathogen recognition receptors, which are present at the surface of the cell or in the cytoplasm. Nucleoti","FALSE","review",""
"17875812","M1","2008","J Leukoc Biol","NLR proteins: integral members of innate immunity and mediators of inflammatory diseases.","Journal Article|Research Support, N.I.H., Extramural|Research Support, Non-U.S. Gov't|Review","review","pubtype=Review","The innate immune system is the first line of defense against microorganisms and is conserved in plants and animals. The nucleotide-binding domain, leucine rich containing (NLR) protein family is a recent addition to the members of innate immunity effector molecules. These proteins are characterized","FALSE","review",""
"17006665","M1","2006","Immunogenetics","Evolutionary relationships of vertebrate NACHT domain-containing proteins.","Journal Article|Research Support, N.I.H., Extramural","ambiguous","survived all mechanical rules","Phylogenetic analyses of conserved [neuronal apoptosis inhibitory protein (NAIP), MHC class II transcription activator (CIITA), incompatibility locus protein from Podospora anserina (HET-E), and telomerase-associated protein (TP1)] (NACHT) domains were used to reconstruct the evolutionary history of","TRUE","ambiguous",""
"16940328","M1","2006","J Leukoc Biol","Triggering receptor expressed on myeloid cells-1 (TREM-1) amplifies the signals induced by the NACHT-LRR (NLR) pattern recognition receptors.","Journal Article|Research Support, N.I.H., Extramural|Research Support, Non-U.S. Gov't","ambiguous","survived all mechanical rules","Triggering receptor expressed on myeloid cells-1 (TREM-1) is a member of a new family of myeloid receptors, encoded by a gene cluster linked to the MHC. Engagement of TREM-1 stimulates intracellular signals, resulting in activation of phagocytosis, neutrophil degranulation, and amplification of cyto","TRUE","ambiguous",""
"16931603","M1","2006","J Leukoc Biol","Immunostimulatory combinations: designing the next generation of vaccine adjuvants.","Journal Article|Research Support, N.I.H., Extramural|Research Support, Non-U.S. Gov't|Research Support, U.S. Gov't, Non-P.H.S.|Review","review","pubtype=Review","Agents that activate dendritic cells are essential components for vaccines and can be conceptualized as molecular adjuvants. Other molecular adjuvants affect downstream factors that shape the resulting immune response. This review provides a compendium of recently studied molecular adjuvants, focusi","FALSE","review",""
"15280366","M1","2004","J Biol Chem","Neuronal apoptosis-inhibitory protein does not interact with Smac and requires ATP to bind caspase-9.","Journal Article|Research Support, Non-U.S. Gov't","ambiguous","survived all mechanical rules","The neuronal apoptosis-inhibitory protein (NAIP) is the founding member of the mammalian family of inhibitor of apoptosis (IAP) proteins (also known as BIRC proteins) and has been shown to be antiapoptotic both in vivo and in vitro. The 160-kDa NAIP contains three distinct regions: an amino-terminal","TRUE","ambiguous",""
"15107016","M1","2004","Biochem J","Heterotypic interactions among NACHT domains: implications for regulation of innate immune responses.","Journal Article|Research Support, U.S. Gov't, Non-P.H.S.|Research Support, U.S. Gov't, P.H.S.","ambiguous","survived all mechanical rules","Proteins of the NACHT [NAIP (neuronal apoptosis inhibitory protein), CIITA (MHC class II transcription activator), HET-E (incompatibility locus protein from Podospora anserina) and TP1 (telomerase-associated protein)] family may serve as critical pathogen-sensing and signal-transducing molecules wit","TRUE","ambiguous",""
"12925128","M1","2003","Cell Microbiol","Nods, Nalps and Naip: intracellular regulators of bacterial-induced inflammation.","Journal Article|Research Support, Non-U.S. Gov't|Review","review","pubtype=Review","The innate immune system is the most ancestral and ubiquitous system of defence against microbial infection. The microbial sensing proteins involved in innate immunity recognize conserved and often structural components of microorganisms. One class of these pattern-recognition molecules, the Toll-li","FALSE","review",""
"39833169","M2","2025","Cell Discov","Apaf-1 is an evolutionarily conserved DNA sensor that switches the cell fate between apoptosis and inflammation.","Journal Article","ambiguous","survived all mechanical rules","Apoptotic protease activating factor 1 (Apaf-1) was traditionally defined as a scaffold protein in mammalian cells for assembling a caspase activation platform known as the 'apoptosome' after its binding to cytochrome c. Although Apaf-1 structurally resembles animal NOD-like receptor (NLR) and plant","TRUE","ambiguous",""
"38381783","M2","2024","Proc Natl Acad Sci U S A","Dark and Dronc activation in Drosophila melanogaster.","Journal Article","ambiguous","survived all mechanical rules","The onset of apoptosis is characterized by a cascade of caspase activation, where initiator caspases are activated by a multimeric adaptor complex known as the apoptosome. In Drosophila melanogaster, the initiator caspase Dronc undergoes autocatalytic activation in the presence of the Dark apoptosom","TRUE","ambiguous",""
"38085782","M2","2023","Proc Natl Acad Sci U S A","Activation of caspase-9 on the apoptosome as studied by methyl-TROSY NMR.","Journal Article|Research Support, Non-U.S. Gov't","ambiguous","survived all mechanical rules","Mitochondrial apoptotic signaling cascades lead to the formation of the apoptosome, a 1.1-MDa heptameric protein scaffold that recruits and activates the caspase-9 protease. Once activated, caspase-9 cleaves and activates downstream effector caspases, triggering the onset of cell death through caspa","TRUE","ambiguous",""
"37622684","M2","2023","Phytother Res","Recent advances in pyroptosis, liver disease, and traditional Chinese medicine: A review.","Journal Article|Review","review","pubtype=Review","In recent years, the incidence of liver disease has increased, becoming a major cause of death. Various liver diseases are intricately linked to pyroptosis, which is one of the most common forms of programmed cell death. As a powerful weapon in the fight against liver diseases, traditional Chinese m","FALSE","review",""
"37563611","M2","2023","J Inflamm (Lond)","Air pollution induces pyroptosis of human monocytes through activation of inflammasomes and Caspase-3-dependent pathways.","Journal Article","ambiguous","survived all mechanical rules","According to the World Health Organization (WHO), air pollution is one of the most serious threats for our planet. Despite a growing public awareness of the harmful effects of air pollution on human health, the specific influence of particulate matter (PM) on human immune cells remains poorly unders","TRUE","ambiguous",""
"37402593","M2","2023","Life Sci Alliance","Structural insights into CED-3 activation.","Journal Article|Research Support, Non-U.S. Gov't","ambiguous","survived all mechanical rules","In Caenorhabditis elegans (C. elegans), onset of programmed cell death is marked with the activation of CED-3, a process that requires assembly of the CED-4 apoptosome. Activated CED-3 forms a holoenzyme with the CED-4 apoptosome to cleave a wide range of substrates, leading to irreversible cell dea","TRUE","ambiguous",""
"36541866","M2","2023","Proteins","Molecular dynamics studies of CED-4/CED-9/EGL-1 ternary complex reveal CED-4 release mechanism in the linear apoptotic pathway of Caenorhabditis elegans.","Journal Article|Research Support, Non-U.S. Gov't","ambiguous","survived all mechanical rules","Many steps in programmed cell death are evolutionarily conserved across different species. The Caenorhabditis elegans proteins CED-9, CED-4 and EGL-1 involved in apoptosis are respectively homologous to anti-apoptotic Bcl-2 proteins, Apaf-1 and the ""BH3-only"" pro-apototic proteins in mammals. In the","TRUE","ambiguous",""
"36323675","M2","2022","Cell Death Discov","Interaction between DLC-1 and SAO-1 facilitates CED-4 translocation during apoptosis in the Caenorhabditis elegans germline.","Journal Article","ambiguous","survived all mechanical rules","Apoptosis is one of the major forms of programmed cell death, and it serves vital biological functions in multicellular animal and plant cells. The core mechanism of apoptosis is highly conserved in metazoans, where the translocation of CED-4/Apaf-1 from mitochondria to the nuclear membrane is requi","TRUE","ambiguous",""
"34514227","M2","2021","ACS Omega","Apoptosome Formation through Disruption of the K192-D616 Salt Bridge in the Apaf-1 Closed Form.","Journal Article","ambiguous","survived all mechanical rules","The molecular mechanism of apoptosome activation through conformational changes of Apaf-1 auto-inhibited form remains largely enigmatic. The crystal structure of Apaf-1 suggests that some ionic bonds, including the bond between K192 and D616, are critical for the preservation of the inactive ""closed","TRUE","ambiguous",""
"34507064","M2","2021","Biochem Biophys Res Commun","Apaf1 nanoLuc biosensors identified lentinan as a potent synergizer of cisplatin in targeting hepatocellular carcinoma cells.","Journal Article|Research Support, Non-U.S. Gov't","ambiguous","survived all mechanical rules","Liver cancer is one of the most common malignancies that is difficult to treat due to late diagnosis and chemo-resistance. In the present study, we developed and validated a cell based split nanoLuc biosensor to monitor the Apaf1-Apaf1 interactions in response to apoptosis-inducing drugs such as cis","TRUE","ambiguous",""
"34417303","M2","2021","Proc Natl Acad Sci U S A","SAMD9L autoinflammatory or ataxia pancytopenia disease mutations activate cell-autonomous translational repression.","Case Reports|Journal Article","ambiguous","survived all mechanical rules","Sterile α motif domain-containing protein 9-like (SAMD9L) is encoded by a hallmark interferon-induced gene with a role in controlling virus replication that is not well understood. Here, we analyze SAMD9L function from the perspective of human mutations causing neonatal-onset severe autoinflammatory","TRUE","ambiguous",""
"34156462","M2","2021","Biochem Soc Trans","The HSP70 chaperone as sensor of the NEDD8 cycle upon DNA damage.","Journal Article|Research Support, Non-U.S. Gov't|Review","review","pubtype=Review","Molecular chaperones are essential components of the protein quality control system and maintenance of homeostasis. Heat Shock Protein 70 (HSP70), a highly evolutionarily conserved family of chaperones is a key regulator of protein folding, oligomerisation and prevents the aggregation of misfolded p","FALSE","review",""
"33132160","M2","2021","Biochimie","Loss of WD2 subdomain of Apaf-1 forms an apoptosome structure which blocks activation of caspase-3 and caspase-9.","Journal Article","ambiguous","survived all mechanical rules","Split luciferase complementary assay has been used to investigate the effect of WD domain deletion on Apaf-1 oligomerization. Apaf-1 is an adaptor molecule in formation of apoptosome that activates caspase-9, an activation that is a key event in the mitochondrial cell death pathway. Structural studi","TRUE","ambiguous",""
"35518317","M2","2020","RSC Adv","Synthesis, crystal structure and antiproliferative mechanisms of gallium(iii) complexes with benzoylpyridine thiosemicarbazones.","Journal Article","ambiguous","survived all mechanical rules","We have prepared six thiosemicarbazone ligands and synthesized the corresponding Ga(iii) complexes. The antitumor activity of the ligand increases with its lipophilicity, and the antitumor activity of the Ga(iii) complexes is affected by the ligands. Since C6 has the highest anticancer proliferative","TRUE","ambiguous",""
"32190819","M2","2020","Nat Catal","Proximity-induced caspase-9 activation on a DNA origami-based synthetic apoptosome.","Journal Article","ambiguous","survived all mechanical rules","Living cells regulate key cellular processes by spatial organisation of catalytically active proteins in higher-order signalling complexes. These act as organising centres to facilitate proximity-induced activation and inhibition of multiple intrinsically weakly associating signalling components, wh","TRUE","ambiguous",""
"31577950","M2","2019","Cell Rep","The Balance between Mono- and NEDD8-Chains Controlled by NEDP1 upon DNA Damage Is a Regulatory Module of the HSP70 ATPase Activity.","Journal Article|Research Support, Non-U.S. Gov't","ambiguous","survived all mechanical rules","Ubiquitin and ubiquitin-like chains are finely balanced by conjugating and de-conjugating enzymes. Alterations in this balance trigger the response to stress conditions and are often observed in pathologies. How such changes are detected is not well understood. We identify the HSP70 chaperone as a s","TRUE","ambiguous",""
"31278906","M2","2019","J Mol Biol","Structural Evidence for an Octameric Ring Arrangement of SARM1.","Journal Article|Research Support, Non-U.S. Gov't","ambiguous","survived all mechanical rules","SARM1 induces axonal degeneration in response to various insults and is therefore considered an attractive drug target for the treatment of neuro-degenerative diseases as well as for brain and spinal cord injuries. SARM1 activity depends on the integrity of the protein's SAM domains, as well as on t","TRUE","ambiguous",""
"30004576","M2","2018","J Comp Neurol","Expression profile of the STAND protein Nwd1 in the developing and mature mouse central nervous system.","Journal Article|Research Support, Non-U.S. Gov't","ambiguous","survived all mechanical rules","The orchestrated events required during brain development, as well as the maintenance of adult neuronal plasticity, highly depend on the accurate responses of neuronal cells to various cellular stress or environmental stimuli. Recent studies have defined a previously unrecognized, broad class of mul","TRUE","ambiguous",""
"29410086","M2","2018","Arch Biochem Biophys","Apoptosome formation upon overexpression of native and truncated Apaf-1 in cell-free and cell-based systems.","Journal Article|Research Support, Non-U.S. Gov't","ambiguous","survived all mechanical rules","Apaf-1 is a cytosolic multi-domain protein in the apoptosis regulatory network. When cytochrome c releases from mitochondria; it binds to WD-40 repeats of Apaf-1 molecule and induces oligomerization of Apaf-1. Here in, a split luciferase assay was used to compare apoptosome formation in cell-free an","TRUE","ambiguous",""
"28716524","M2","2017","Cancer Lett","The E3 ligase HECTD3 promotes esophageal squamous cell carcinoma (ESCC) growth and cell survival through targeting and inhibiting caspase-9 activation.","Journal Article","ambiguous","survived all mechanical rules","Apoptosis resistance is an acquired hallmark of cancer cells and many factors can contribute to the tumor cell apoptosis resistance. In this study, we demonstrated that HECTD3, overexpressed in human esophageal squamous cell carcinoma (ESCC), confers cells resistance to cisplatin-induced apoptosis a","TRUE","ambiguous",""
"28380338","M2","2017","Structure","Understanding CARD Tricks in Apoptosomes.","Journal Article|Comment","ambiguous","survived all mechanical rules","While earlier studies of Apaf-1 holo-apoptosome architecture revealed the spectacular heptameric wheel-like structure formed by Apaf-1, the central CARD disk responsible for caspase-9 recruitment remained incompletely resolved. In a recent issue of Structure, Su et al. (2017) describe a crystal stru","TRUE","ambiguous",""
"28192157","M2","2017","Biochimie","Apaf-1: Regulation and function in cell death.","Journal Article|Review","review","pubtype=Review","Apoptosis, a form of programmed cell death, is responsible for eliminating damaged or unnecessary cells in multicellular organisms. Various types of intracellular stress trigger apoptosis by induction of cytochrome c release from mitochondria into the cytosol. Apoptotic protease activating factor-1 ","FALSE","review",""
"28143931","M2","2017","Proc Natl Acad Sci U S A","Mechanistic insights into caspase-9 activation by the structure of the apoptosome holoenzyme.","Journal Article|Research Support, Non-U.S. Gov't","ambiguous","survived all mechanical rules","Mammalian intrinsic apoptosis requires activation of the initiator caspase-9, which then cleaves and activates the effector caspases to execute cell killing. The heptameric Apaf-1 apoptosome is indispensable for caspase-9 activation by together forming a holoenzyme. The molecular mechanism of caspas","TRUE","ambiguous",""
"28111022","M2","2017","Structure","Structural Insights into DD-Fold Assembly and Caspase-9 Activation by the Apaf-1 Apoptosome.","Journal Article|Research Support, Non-U.S. Gov't","ambiguous","survived all mechanical rules","Death domain (DD)-fold assemblies play a crucial role in regulating the signaling to cell survival or death. Here we report the crystal structure of the caspase recruitment domain (CARD)-CARD disk of the human apoptosome. The structure surprisingly reveals that three 1:1 Apaf-1:procaspase-9 CARD pro","TRUE","ambiguous",""
"28030552","M2","2016","PLoS One","Cytochrome c Negatively Regulates NLRP3 Inflammasomes.","Journal Article","ambiguous","survived all mechanical rules","The release of cytochrome c from the inner mitochondrial membrane, where it is anchored by caridolipin, triggers the formation of the Apaf-1 apoptosome. Cardiolipin also interacts with NLRP3 recruiting NLRP3 to mitochondria and facilitating inflammasome assembly. In this study we investigated whethe","TRUE","ambiguous",""
"27916517","M2","2017","Structure","A Near-Atomic Structure of the Dark Apoptosome Provides Insight into Assembly and Activation.","Journal Article","ambiguous","survived all mechanical rules","In Drosophila, the Apaf-1-related killer (Dark) forms an apoptosome that activates procaspases. To investigate function, we have determined a near-atomic structure of Dark double rings using cryo-electron microscopy. We then built a nearly complete model of the apoptosome that includes 7- and 8-blad","TRUE","ambiguous",""
"27884192","M2","2016","Mol Neurodegener","Role of cytochrome c in α-synuclein radical formation: implications of α-synuclein in neuronal death in Maneb- and paraquat-induced model of Parkinson's disease.","Journal Article|Research Support, N.I.H., Intramural","ambiguous","survived all mechanical rules","BACKGROUND: The pathological features of Parkinson's disease (PD) include an abnormal accumulation of α-synuclein in the surviving dopaminergic neurons. Though PD is multifactorial, several epidemiological reports show an increased incidence of PD with co-exposure to pesticides such as Maneb and par","TRUE","ambiguous",""
"30108704","M2","2017","Medchemcomm","Synthesis, crystal structure, cytotoxicity and action mechanism of a Rh(iii) complex with 8-hydroxy-2-methylquinoline as a ligand.","Journal Article","ambiguous","survived all mechanical rules","A rhodium(iii) complex, [Rh(MQ)(DMSO)2Cl2] (1), with 8-hydroxy-2-methylquinoline as the ligand was synthesized and characterized. Complex 1 exhibited cytotoxicity against BEL-7404, Hep-G2, NCI-H460, T-24, and A549 cell lines with IC50 values in the micromolar range (6.52-17.86 μM). Various experimen","TRUE","ambiguous",""
