"pmid","queries_hit","year","journal","title","pubtypes","disposition","rule_fired","abstract_snippet","needs_human_review","final_disposition","manual_notes"
"36205456","P3","2022","Curr Protoc","Isolation of Protein Complexes from Tobacco Leaves by a Two-Step Tandem Affinity Purification.","Journal Article","ambiguous","survived all mechanical rules","Protein purification is an essential method for understanding protein function, as many biochemical and structural techniques require a high concentration of isolated protein for analysis. Yet, many studies of protein complexes are hampered by our inability to express them recombinantly in model sys","TRUE","ambiguous",""
"36180934","P3","2023","Mol Plant Pathol","The northern corn leaf blight resistance gene Ht1 encodes an nucleotide-binding, leucine-rich repeat immune receptor.","Journal Article","ambiguous","survived all mechanical rules","Northern corn leaf blight, caused by the fungal pathogen Exserohilum turcicum, is a major disease of maize. The first major locus conferring resistance to E. turcicum race 0, Ht1, was identified over 50 years ago, but the underlying gene has remained unknown. We employed a map-based cloning strategy","TRUE","ambiguous",""
"35766176","P3","2022","Mol Plant Pathol","The activity of the RGA5 sensor NLR from rice requires binding of its integrated HMA domain to effectors but not HMA domain self-interaction.","Journal Article|Research Support, Non-U.S. Gov't","ambiguous","survived all mechanical rules","The rice nucleotide-binding (NB) and leucine-rich repeat (LRR) domain immune receptors (NLRs) RGA4 and RGA5 form a helper NLR/sensor NLR (hNLR/sNLR) pair that specifically recognizes the effectors AVR-Pia and AVR1-CO39 from the blast fungus Magnaporthe oryzae. While RGA4 contains only canonical NLR ","TRUE","ambiguous",""
"35735291","P3","2022","Essays Biochem","Insight into the structure and molecular mode of action of plant paired NLR immune receptors.","Journal Article|Review|Research Support, Non-U.S. Gov't","review","pubtype=Review","The specific recognition of pathogen effectors by intracellular nucleotide-binding domain and leucine-rich repeat receptors (NLRs) is an important component of plant immunity. NLRs have a conserved modular architecture and can be subdivided according to their signaling domain that is mostly a coiled","FALSE","review",""
"35635051","P3","2022","Essays Biochem","Show me your ID: NLR immune receptors with integrated domains in plants.","Journal Article","ambiguous","survived all mechanical rules","Nucleotide-binding and leucine-rich repeat receptors (NLRs) are intracellular plant immune receptors that recognize pathogen effectors secreted into the plant cell. Canonical NLRs typically contain three conserved domains including a central nucleotide binding (NB-ARC) domain, C-terminal leucine-ric","TRUE","ambiguous",""
"35312080","P3","2022","Plant Cell Environ","Three highly conserved hydrophobic residues in the predicted α2-helix of rice NLR protein Pit contribute to its localization and immune induction.","Journal Article","ambiguous","survived all mechanical rules","Nucleotide-binding leucine-rich repeat (NLR) proteins work as crucial intracellular immune receptors. N-terminal domains of NLRs fall into two groups, coiled-coil (CC) and Toll-interleukin 1 receptor domains, which play critical roles in signal transduction and disease resistance. However, the activ","TRUE","ambiguous",""
"35072788","P3","2022","Cell Mol Life Sci","Revisiting ZAR proteins: the understudied regulator of female fertility and beyond.","Journal Article|Review","review","pubtype=Review","Putative RNA-binding proteins (RBPs), zygote arrested-1 (ZAR1), and ZAR2 (also known as ZAR1L), have been identified as maternal factors that mainly function in oogenesis and embryogenesis. Despite divergence in their spatio-temporal expression among species, the CxxC structure of the C-terminus of ","FALSE","review",""
"34981187","P3","2022","Immunogenetics","Structural basis of NLR activation and innate immune signalling in plants.","Journal Article|Research Support, Non-U.S. Gov't|Review","review","pubtype=Review","Animals and plants have NLRs (nucleotide-binding leucine-rich repeat receptors) that recognize the presence of pathogens and initiate innate immune responses. In plants, there are three types of NLRs distinguished by their N-terminal domain: the CC (coiled-coil) domain NLRs, the TIR (Toll/interleuki","FALSE","review",""
"33999918","P3","2021","PLoS One","Genome-wide association mapping identifies yellow rust resistance loci in Ethiopian durum wheat germplasm.","Journal Article|Research Support, Non-U.S. Gov't","no_structure","no structural vocabulary in title/abstract","Durum wheat is an important cereal grown in Ethiopia, a country which is also its center for genetic diversity. Yellow (stripe) rust caused by Puccinia striiformis fsp tritici is one of the most devastating diseases threatening Ethiopian wheat production. To identify sources of genetic resistance an","FALSE","no_structure",""
"33692829","P3","2021","Front Genet","Genome-Scale Phylogenetic and Population Genetic Studies Provide Insight Into Introgression and Adaptive Evolution of Takifugu Species in East Asia.","Journal Article","ambiguous","survived all mechanical rules","As a typical marine adaptive radiation species, most Takifugu species are widely distributed in East Asian offshore, which have diversified morphological characteristics and different ecological habits. The phylogenetic relationship and population structure of the Takifugu species was complicated be","TRUE","ambiguous",""
"33635550","P3","2021","Angew Chem Int Ed Engl","Unravelling the Structure of a Medium-Sized Metalloid Gold Nanocluster and its Filming Property.","Journal Article","ambiguous","survived all mechanical rules","Unravelling the structure of thiolated metalloid gold nanoclusters in the medium-sized range by single crystal X-ray crystallography (SCXC) is challenging. Herein, we successfully synthesized a novel Au67 (SR)35 nanocluster, and unravelled its single crystal structure by SCXC, which features a mix-s","TRUE","ambiguous",""
"33576803","P3","2021","Plant Physiol","A semi-dominant NLR allele causes whole-seedling necrosis in wheat.","Journal Article|Research Support, Non-U.S. Gov't|Research Support, U.S. Gov't, Non-P.H.S.","ambiguous","survived all mechanical rules","Programmed cell death (PCD) and apoptosis have key functions in development and disease resistance in diverse organisms; however, the induction of necrosis remains poorly understood. Here, we identified a semi-dominant mutant allele that causes the necrotic death of the entire seedling (DES) of whea","TRUE","ambiguous",""
"32506157","P3","2020","Biochem Genet","Identification and Distribution of NBS-Encoding Resistance Genes of Dactylis glomerata L. and Its Expression Under Abiotic and Biotic Stress.","Journal Article","no_structure","no structural vocabulary in title/abstract","Orchardgrass (Dactylis glomerata L.) is drought resistant and tolerant to barren landscapes, making it one of the most important forages for animal husbandry, as well as ecological restoration of rocky landscapes that are undergoing desertification. However, orchardgrass is susceptible to rust, whic","FALSE","no_structure",""
"31557357","P3","2020","Plant J","Structure-function analysis of ZAR1 immune receptor reveals key molecular interactions for activity.","Journal Article|Research Support, Non-U.S. Gov't|Research Support, U.S. Gov't, Non-P.H.S.","ambiguous","survived all mechanical rules","NLR (nucleotide-binding [NB] leucine-rich repeat [LRR] receptor) proteins are critical for inducing immune responses in response to pathogen proteins, and must be tightly modulated to prevent spurious activation in the absence of a pathogen. The ZAR1 NLR recognizes diverse effector proteins from Pse","TRUE","ambiguous",""
"30859446","P3","2019","Mol Biol Rep","Identification of novel miRNAs and their target genes from Populus szechuanica infected with Melampsora larici-populina.","Journal Article","no_structure","no structural vocabulary in title/abstract","Two novel miRNAs were selected from a pre-constructed RNA library of Populus szechuanica infected with the foliar rust fungus Melampsora larici-populina in order to detect the genes regulated as targets of the miRNAs novel_mir_11 and novel_mir_357. The novel miRNAs were identified from P. szechuanic","FALSE","no_structure",""
"30355769","P3","2018","Proc Natl Acad Sci U S A","Specific recognition of two MAX effectors by integrated HMA domains in plant immune receptors involves distinct binding surfaces.","Journal Article|Research Support, Non-U.S. Gov't","ambiguous","survived all mechanical rules","The structurally conserved but sequence-unrelated MAX (Magnaporthe oryzae avirulence and ToxB-like) effectors AVR1-CO39 and AVR-PikD from the blast fungus M. oryzae are recognized by the rice nucleotide-binding domain and leucine-rich repeat proteins (NLRs) RGA5 and Pikp-1, respectively. This involv","TRUE","ambiguous",""
"29633975","P3","2018","Acta Crystallogr F Struct Biol Commun","Crystallization of the rice immune receptor RGA5A_S with the rice blast fungus effector AVR1-CO39 prepared via mixture and tandem strategies.","Journal Article|Research Support, Non-U.S. Gov't","ambiguous","survived all mechanical rules","RGA5 is a component of the Pia resistance-protein pair (RGA4/RGA5) from Oryza sativa L. japonica. It acts as an immune receptor that directly recognizes the effector AVR1-CO39 from Magnaporthe oryzae via a C-terminal non-LRR domain (RGA5A_S). The interaction between RGA5A_S and AVR1-CO39 relieves th","TRUE","ambiguous",""
"28808003","P3","2017","Proc Natl Acad Sci U S A","Signaling from the plasma-membrane localized plant immune receptor RPM1 requires self-association of the full-length protein.","Journal Article|Research Support, N.I.H., Extramural|Research Support, Non-U.S. Gov't|Research Support, U.S. Gov't, Non-P.H.S.","no_structure","no structural vocabulary in title/abstract","Plants evolved intracellular immune receptors that belong to the NOD-like receptor (NLR) family to recognize the presence of pathogen-derived effector proteins. NLRs possess an N-terminal Toll-like/IL-1 receptor (TIR) or a non-TIR domain [some of which contain coiled coils (CCs)], a central nucleoti","FALSE","no_structure",""
"28673818","P3","2017","Dev Biol","Distinct cis elements in the 3' UTR of the C. elegans cebp-1 mRNA mediate its regulation in neuronal development.","Journal Article|Research Support, Non-U.S. Gov't|Research Support, N.I.H., Extramural","no_structure","no structural vocabulary in title/abstract","The 3' untranslated regions (3' UTRs) of mRNAs mediate post-transcriptional regulation of genes in many biological processes. Cis elements in 3' UTRs can interact with RNA-binding factors in sequence-specific or structure-dependent manners, enabling regulation of mRNA stability, translation, and loc","FALSE","no_structure",""
"28652264","P3","2017","Plant Physiol","Analysis of the ZAR1 Immune Complex Reveals Determinants for Immunity and Molecular Interactions.","Journal Article","ambiguous","survived all mechanical rules","Plants depend on innate immunity to prevent disease. Plant pathogenic bacteria, like Pseudomonas syringae and Xanthomonas campestris, use the type III secretion system as a molecular syringe to inject type III secreted effector (T3SE) proteins in plants. The primary function of most T3SEs is to supp","TRUE","ambiguous",""
"28087830","P3","2017","Plant Cell","Recognition of the Magnaporthe oryzae Effector AVR-Pia by the Decoy Domain of the Rice NLR Immune Receptor RGA5.","Journal Article|Research Support, Non-U.S. Gov't","no_structure","no structural vocabulary in title/abstract","Nucleotide binding domain and leucine-rich repeat proteins (NLRs) are important receptors in plant immunity that allow recognition of pathogen effectors. The rice (Oryza sativa) NLR RGA5 recognizes the Magnaporthe oryzae effector AVR-Pia through direct interaction. Here, we gained detailed insights ","FALSE","no_structure",""
"27979965","P3","2017","J Biol Chem","Defining Minimal Binding Regions in Regulator of Presynaptic Morphology 1 (RPM-1) Using Caenorhabditis elegans Neurons Reveals Differential Signaling Complexes.","Journal Article|Research Support, N.I.H., Extramural|Research Support, U.S. Gov't, Non-P.H.S.","ambiguous","survived all mechanical rules","The intracellular signaling protein regulator of presynaptic morphology 1 (RPM-1) is a conserved regulator of synapse formation and axon termination in Caenorhabditis elegans RPM-1 functions in a ubiquitin ligase complex with the F-box protein FSN-1 and functions through the microtubule binding prot","TRUE","ambiguous",""
"27427964","P3","2016","PLoS Pathog","Multiple Domain Associations within the Arabidopsis Immune Receptor RPP1 Regulate the Activation of Programmed Cell Death.","Journal Article|Research Support, U.S. Gov't, Non-P.H.S.","ambiguous","survived all mechanical rules","Upon recognition of pathogen virulence effectors, plant nucleotide-binding leucine-rich repeat (NLR) proteins induce defense responses including localized host cell death. In an effort to understand the molecular mechanisms leading to this response, we examined the Arabidopsis thaliana NLR protein R","TRUE","ambiguous",""
"27150007","P3","2016","BMC Evol Biol","R-gene variation across Arabidopsis lyrata subspecies: effects of population structure, selection and mating system.","Journal Article|Research Support, Non-U.S. Gov't","no_structure","no structural vocabulary in title/abstract","BACKGROUND: Examining allelic variation of R-genes in closely related perennial species of Arabidopsis thaliana is critical to understanding how population structure and ecology interact with selection to shape the evolution of innate immunity in plants. We finely sampled natural populations of Arab","FALSE","no_structure",""
"25664791","P3","2015","Acta Crystallogr F Struct Biol Commun","Expression, purification, crystallization and preliminary X-ray diffraction analysis of the effector-interaction domain of the resistance protein RGA5-A from Oryza sativa L. japonica.","Journal Article|Research Support, Non-U.S. Gov't","ambiguous","survived all mechanical rules","RGA5-A, a component of the Pia resistance-protein complex (RGA4/RGA5-A) from Oryza sativa L. japonica, has the ability to interact physically with the effector protein AVR-Pia from Magnaporthe oryzae via its effector-interaction domain RGA5-A_S. The interaction between RGA5-A and AVR-Pia relieves th","TRUE","ambiguous",""
"25326385","P3","2014","J Biol Chem","Identification of a peptide inhibitor of the RPM-1 · FSN-1 ubiquitin ligase complex.","Journal Article|Research Support, N.I.H., Extramural|Research Support, U.S. Gov't, Non-P.H.S.","ambiguous","survived all mechanical rules","The Pam/Highwire/RPM-1 (PHR) proteins include: Caenorhabditis elegans RPM-1 (Regulator of Presynaptic Morphology 1), Drosophila Highwire, and murine Phr1. These important regulators of neuronal development function in synapse formation, axon guidance, and axon termination. In mature neurons the PHR ","TRUE","ambiguous",""
"25039985","P3","2014","FEBS J","The intrinsically disordered structural platform of the plant defence hub protein RPM1-interacting protein 4 provides insights into its mode of action in the host-pathogen interface and evolution of the nitrate-induced domain protein family.","Journal Article|Research Support, Non-U.S. Gov't","ambiguous","survived all mechanical rules","Arabidopsis thaliana (At) RPM1-interacting protein 4 (RIN4), targeted by many defence-suppressing bacterial type III effectors and monitored by several resistance proteins, regulates plant immune responses to pathogen-associated molecular patterns and type III effectors. Little is known about the ov","TRUE","ambiguous",""
"25034017","P3","2014","Plant Physiol","Evolutionary relationship of disease resistance genes in soybean and Arabidopsis specific for the Pseudomonas syringae effectors AvrB and AvrRpm1.","Journal Article|Research Support, N.I.H., Extramural|Research Support, Non-U.S. Gov't|Research Support, U.S. Gov't, Non-P.H.S.","ambiguous","survived all mechanical rules","In Arabidopsis (Arabidopsis thaliana), the Pseudomonas syringae effector proteins AvrB and AvrRpm1 are both detected by the RESISTANCE TO PSEUDOMONAS MACULICOLA1 (RPM1) disease resistance (R) protein. By contrast, soybean (Glycine max) can distinguish between these effectors, with AvrB and AvrRpm1 b","TRUE","ambiguous",""
"24211527","P3","2014","J Theor Biol","Molecular modeling, simulation and virtual screening of ribosomal phosphoprotein P1 from Plasmodium falciparum.","Journal Article","ambiguous","survived all mechanical rules","Ribosomal phosphoprotein P1 (RPP1) is acidic phosphoprotein which in association with neutral phosphoprotein P0 and acidic phosphoprotein P2 forms ribosomal P protein complex as (P1)2-P0-(P2)2. P protein is known to be immunogenic and has important role in protein translation. 3D structure of P1 is ","TRUE","ambiguous",""
"21984695","P3","2011","Plant Cell","Separable fragments and membrane tethering of Arabidopsis RIN4 regulate its suppression of PAMP-triggered immunity.","Journal Article|Research Support, Non-U.S. Gov't","no_structure","no structural vocabulary in title/abstract","RPM1-interacting protein 4 (RIN4) is a multifunctional Arabidopsis thaliana protein that regulates plant immune responses to pathogen-associated molecular patterns (PAMPs) and bacterial type III effector proteins (T3Es). RIN4, which is targeted by multiple defense-suppressing T3Es, provides a mechan","FALSE","no_structure",""
"21788488","P3","2011","Proc Natl Acad Sci U S A","Hyaloperonospora arabidopsidis ATR1 effector is a repeat protein with distributed recognition surfaces.","Journal Article|Research Support, U.S. Gov't, Non-P.H.S.","ambiguous","survived all mechanical rules","The in planta association of the Hyaloperonospora arabidopsidis effector ATR1 with the cognate Arabidopsis thaliana RPP1 immune receptor activates a disease-resistance signaling pathway that inhibits pathogen growth. To define the molecular events specifying effector recognition by RPP1, we determin","TRUE","ambiguous",""
"20156452","P3","2010","J Mol Biol","Structures of PHR domains from Mus musculus Phr1 (Mycbp2) explain the loss-of-function mutation (Gly1092-->Glu) of the C. elegans ortholog RPM-1.","Journal Article|Research Support, N.I.H., Extramural|Research Support, U.S. Gov't, Non-P.H.S.","ambiguous","survived all mechanical rules","PHR [PAM (protein associated with Myc)-HIW (Highwire)-RPM-1 (regulator of presynaptic morphology 1)] proteins are conserved, large multi-domain E3 ubiquitin ligases with modular architecture. PHR proteins presynaptically control synaptic growth and axon guidance and postsynaptically regulate endocyt","TRUE","ambiguous",""
"18442940","P3","2008","Comp Biochem Physiol B Biochem Mol Biol","A putative protein structurally related to zygote arrest 1 (Zar1), Zar1-like, is encoded by a novel gene conserved in the vertebrate lineage.","Journal Article|Research Support, Non-U.S. Gov't","ambiguous","survived all mechanical rules","Identification and characterization of a bovine cDNA and the corresponding gene coding for a novel protein structurally related to Zar1, therefore called Zar1-like, are here reported for the first time. Structure of Zar1-like is similar to Zar1 gene, nevertheless they are located on distinct chromos","TRUE","ambiguous",""
"17397263","P3","2007","PLoS Pathog","Type III effector activation via nucleotide binding, phosphorylation, and host target interaction.","Journal Article|Research Support, N.I.H., Extramural|Research Support, Non-U.S. Gov't|Research Support, U.S. Gov't, Non-P.H.S.","ambiguous","survived all mechanical rules","The Pseudomonas syringae type III effector protein avirulence protein B (AvrB) is delivered into plant cells, where it targets the Arabidopsis RIN4 protein (resistance to Pseudomonas maculicula protein 1 [RPM1]-interacting protein). RIN4 is a regulator of basal host defense responses. Targeting of R","TRUE","ambiguous",""
"17207566","P3","2007","Biochimie","A 40.7 kDa Rpp30/Rpp1 homologue is a protein subunit of Dictyostelium discoideum RNase P holoenzyme.","Journal Article|Research Support, Non-U.S. Gov't","ambiguous","survived all mechanical rules","RNase P is an essential and ubiquitous endonuclease that mediates the maturation of the 5' ends of all precursor tRNA molecules. The holoenzyme from Dictyostelium discoideum possesses RNA and protein subunits essential for activity, but the exact composition of the ribonucleoprotein complex is still","TRUE","ambiguous",""
"16677306","P3","2006","Mol Microbiol","AvrB mutants lose both virulence and avirulence activities on soybean and Arabidopsis.","Journal Article|Research Support, N.I.H., Extramural|Research Support, U.S. Gov't, Non-P.H.S.","no_structure","no structural vocabulary in title/abstract","The Pseudomonas syringae pv. glycinea effector protein AvrB induces resistance responses in soybean varieties that contain the resistance gene Rpg1-b and Arabidopsis varieties that carry RPM1. In addition to this avirulence activity, AvrB also enhances bacterial virulence on soybean plants that lack","FALSE","no_structure",""
"16626462","P3","2006","Mol Ecol","Distribution of genetic variation within and among local populations of Arabidopsis thaliana over its species range.","Journal Article|Research Support, Non-U.S. Gov't|Research Support, U.S. Gov't, Non-P.H.S.","ambiguous","survived all mechanical rules","A detailed description of local population structure in Arabidopsis thaliana is presented, including an assessment of the genetic relatedness of individuals collected from the same field. A hierarchical sample of four individuals from 37 local populations, including North America, England, Eastern a","TRUE","ambiguous",""
"15016364","P3","2004","Structure","Crystal structure of the type III effector AvrB from Pseudomonas syringae.","Journal Article","ambiguous","survived all mechanical rules","AvrB is a Pseudomonas syringae type III effector protein that is translocated into host plant cells during attempted pathogenesis. Arabidopsis harboring the corresponding resistance protein RPM1 can detect AvrB and mount a rapid host defense response, thus avoiding active infection. In the plant cel","TRUE","ambiguous",""
"11884685","P3","2002","Plant Cell","Large-scale structure-function analysis of the Arabidopsis RPM1 disease resistance protein.","Journal Article|Research Support, Non-U.S. Gov't|Research Support, U.S. Gov't, Non-P.H.S.","no_structure","no structural vocabulary in title/abstract","The Arabidopsis RPM1 gene confers resistance against Pseudomonas syringae expressing either the AvrRpm1 or the AvrB type III effector protein. We present an exhaustive genetic screen for mutants that no longer recognize avrRpm1. Using an inducible avrRpm1 expression system, we identified 110 indepen","FALSE","no_structure",""
"9034619","P3","1996","Cell Biol Toxicol","Isolated glomeruli and cultured mesangial cells as in vitro models to study immunosuppressive agents.","Journal Article|Review","review","pubtype=Review","Immunosuppressive agents, such as cyclosporin A (CsA), by their vasoconstrictive properties, induce in vivo in patients and rodents a dramatic fall in renal hemodynamics. The aim of this study is to review the ability of some physiological and/or pharmacological agents which are supposed to be invol","FALSE","review",""
"7638602","P3","1995","Science","Structure of the Arabidopsis RPM1 gene enabling dual specificity disease resistance.","Journal Article|Research Support, Non-U.S. Gov't|Research Support, U.S. Gov't, P.H.S.","ambiguous","survived all mechanical rules","Plants can recognize pathogens through the action of disease resistance (R) genes, which confer resistance to pathogens expressing unique corresponding avirulence (avr) genes. The molecular basis of this gene-for-gene specificity is unknown. The Arabidopsis thaliana RPM1 gene enables dual specificit","TRUE","ambiguous",""
"7708503","P3","1995","Nucleic Acids Res","Successful transformation of yeast mitochondria with RPM1: an approach for in vivo studies of mitochondrial RNase P RNA structure, function and biosynthesis.","Journal Article","no_structure","no structural vocabulary in title/abstract","Mitochondrial RNase P RNA (Rpm1r) is coded by the RPM1 gene of mitochondrial DNA in many yeasts. As an initial step to developing a genetic approach to the structure and biogenesis of yeast mitochondrial RNase P, biolistic transformation has been used to introduce wild type and altered RPM1 genes in","FALSE","no_structure",""
"41962712","M1","2026","Int J Biol Macromol","NIM5 series brain-penetrant NLRP3 inflammasome inhibitors suppress neuroinflammation in EAE and Alzheimer's models.","Journal Article","ambiguous","survived all mechanical rules","Aberrant activation of the nucleotide-binding oligomerization domain (NOD)-like receptor family pyrin domain-containing 3 (NLRP3) inflammasome drives neuroinflammation in multiple sclerosis (MS), experimental autoimmune encephalomyelitis (EAE), and Alzheimer's disease (AD). No clinically approved CN","TRUE","ambiguous",""
